{
  "$schema": "https://example.local/schemas/verse-typing-race.schema.json",
  "game": "verse-typing-race",
  "version": 1,
  "displayName": "Verse Typing Race",
  "roundsPerSession": 5,
  "sessions": [
    {
      "id": "vtr-session-01",
      "title": "Verse Typing Race Deck 1",
      "theme": "Creation",
      "rounds": [
        {
          "id": "vtr-r001-genesis-1-1",
          "reference": "Genesis 1:1",
          "sourceTranslation": "KJV",
          "theme": "Creation",
          "verseText": "In the beginning God created the heaven and the earth.",
          "difficulty": "easy",
          "teachingNote": "Review Genesis 1:1 and the full verse before continuing."
        },
        {
          "id": "vtr-r002-exodus-14-14",
          "reference": "Exodus 14:14",
          "sourceTranslation": "KJV",
          "theme": "Deliverance",
          "verseText": "The LORD shall fight for you, and ye shall hold your peace.",
          "difficulty": "medium",
          "teachingNote": "Review Exodus 14:14 and the full verse before continuing."
        },
        {
          "id": "vtr-r003-psalm-23-1",
          "reference": "Psalm 23:1",
          "sourceTranslation": "KJV",
          "theme": "Provision",
          "verseText": "The LORD is my shepherd; I shall not want.",
          "difficulty": "easy",
          "teachingNote": "Review Psalm 23:1 and the full verse before continuing."
        },
        {
          "id": "vtr-r004-proverbs-3-5",
          "reference": "Proverbs 3:5",
          "sourceTranslation": "KJV",
          "theme": "Trust",
          "verseText": "Trust in the LORD with all thine heart; and lean not unto thine own understanding.",
          "difficulty": "medium",
          "teachingNote": "Review Proverbs 3:5 and the full verse before continuing."
        },
        {
          "id": "vtr-r005-habakkuk-2-4",
          "reference": "Habakkuk 2:4",
          "sourceTranslation": "KJV",
          "theme": "Faith",
          "verseText": "Behold, his soul which is lifted up is not upright in him: but the just shall live by his faith.",
          "difficulty": "easy",
          "teachingNote": "Review Habakkuk 2:4 and the full verse before continuing."
        }
      ]
    },
    {
      "id": "vtr-session-02",
      "title": "Verse Typing Race Deck 2",
      "theme": "Witness",
      "rounds": [
        {
          "id": "vtr-r006-matthew-5-16",
          "reference": "Matthew 5:16",
          "sourceTranslation": "KJV",
          "theme": "Witness",
          "verseText": "Let your light so shine before men, that they may see your good works, and glorify your Father which is in heaven.",
          "difficulty": "medium",
          "teachingNote": "Review Matthew 5:16 and the full verse before continuing."
        },
        {
          "id": "vtr-r007-matthew-11-28",
          "reference": "Matthew 11:28",
          "sourceTranslation": "KJV",
          "theme": "Rest",
          "verseText": "Come unto me, all ye that labour and are heavy laden, and I will give you rest.",
          "difficulty": "hard",
          "teachingNote": "Review Matthew 11:28 and the full verse before continuing."
        },
        {
          "id": "vtr-r008-john-3-16",
          "reference": "John 3:16",
          "sourceTranslation": "KJV",
          "theme": "Salvation",
          "verseText": "For God so loved the world, that he gave his only begotten Son, that whosoever believeth in him should not perish, but have everlasting life.",
          "difficulty": "easy",
          "teachingNote": "Review John 3:16 and the full verse before continuing."
        },
        {
          "id": "vtr-r009-john-14-6",
          "reference": "John 14:6",
          "sourceTranslation": "KJV",
          "theme": "Way",
          "verseText": "Jesus saith unto him, I am the way, the truth, and the life: no man cometh unto the Father, but by me.",
          "difficulty": "hard",
          "teachingNote": "Review John 14:6 and the full verse before continuing."
        },
        {
          "id": "vtr-r010-romans-8-28",
          "reference": "Romans 8:28",
          "sourceTranslation": "KJV",
          "theme": "Purpose",
          "verseText": "And we know that all things work together for good to them that love God, to them who are the called according to his purpose.",
          "difficulty": "easy",
          "teachingNote": "Review Romans 8:28 and the full verse before continuing."
        }
      ]
    },
    {
      "id": "vtr-session-03",
      "title": "Verse Typing Race Deck 3",
      "theme": "Love",
      "rounds": [
        {
          "id": "vtr-r011-1-corinthians-13-4",
          "reference": "1 Corinthians 13:4",
          "sourceTranslation": "KJV",
          "theme": "Love",
          "verseText": "Charity suffereth long, and is kind; charity envieth not; charity vaunteth not itself, is not puffed up,",
          "difficulty": "hard",
          "teachingNote": "Review 1 Corinthians 13:4 and the full verse before continuing."
        },
        {
          "id": "vtr-r012-galatians-5-22",
          "reference": "Galatians 5:22",
          "sourceTranslation": "KJV",
          "theme": "Character",
          "verseText": "But the fruit of the Spirit is love, joy, peace, longsuffering, gentleness, goodness, faith,",
          "difficulty": "easy",
          "teachingNote": "Review Galatians 5:22 and the full verse before continuing."
        },
        {
          "id": "vtr-r013-ephesians-2-8",
          "reference": "Ephesians 2:8",
          "sourceTranslation": "KJV",
          "theme": "Grace",
          "verseText": "For by grace are ye saved through faith; and that not of yourselves: it is the gift of God:",
          "difficulty": "medium",
          "teachingNote": "Review Ephesians 2:8 and the full verse before continuing."
        },
        {
          "id": "vtr-r014-philippians-4-6",
          "reference": "Philippians 4:6",
          "sourceTranslation": "KJV",
          "theme": "Prayer",
          "verseText": "Be careful for nothing; but in every thing by prayer and supplication with thanksgiving let your requests be made known unto God.",
          "difficulty": "hard",
          "teachingNote": "Review Philippians 4:6 and the full verse before continuing."
        },
        {
          "id": "vtr-r015-philippians-4-13",
          "reference": "Philippians 4:13",
          "sourceTranslation": "KJV",
          "theme": "Strength",
          "verseText": "I can do all things through Christ which strengtheneth me.",
          "difficulty": "easy",
          "teachingNote": "Review Philippians 4:13 and the full verse before continuing."
        }
      ]
    },
    {
      "id": "vtr-session-04",
      "title": "Verse Typing Race Deck 4",
      "theme": "Care",
      "rounds": [
        {
          "id": "vtr-r016-1-peter-5-7",
          "reference": "1 Peter 5:7",
          "sourceTranslation": "KJV",
          "theme": "Care",
          "verseText": "Casting all your care upon him; for he careth for you.",
          "difficulty": "hard",
          "teachingNote": "Review 1 Peter 5:7 and the full verse before continuing."
        },
        {
          "id": "vtr-r017-john-11-2",
          "reference": "John 11:2",
          "sourceTranslation": "KJV",
          "theme": "God's Character",
          "verseText": "(It was that Mary which anointed the Lord with ointment, and wiped his feet with her hair, whose brother Lazarus was sick.)",
          "difficulty": "medium",
          "teachingNote": "Review John 11:2 and the full verse before continuing."
        },
        {
          "id": "vtr-r018-john-11-43",
          "reference": "John 11:43",
          "sourceTranslation": "KJV",
          "theme": "Scripture",
          "verseText": "And when he thus had spoken, he cried with a loud voice, Lazarus, come forth.",
          "difficulty": "hard",
          "teachingNote": "Review John 11:43 and the full verse before continuing."
        },
        {
          "id": "vtr-r019-john-12-28",
          "reference": "John 12:28",
          "sourceTranslation": "KJV",
          "theme": "Scripture",
          "verseText": "Father, glorify thy name. Then came there a voice from heaven, saying, I have both glorified it, and will glorify it again.",
          "difficulty": "easy",
          "teachingNote": "Review John 12:28 and the full verse before continuing."
        },
        {
          "id": "vtr-r020-john-13-20",
          "reference": "John 13:20",
          "sourceTranslation": "KJV",
          "theme": "Scripture",
          "verseText": "Verily, verily, I say unto you, He that receiveth whomsoever I send receiveth me; and he that receiveth me receiveth him that sent me.",
          "difficulty": "medium",
          "teachingNote": "Review John 13:20 and the full verse before continuing."
        }
      ]
    },
    {
      "id": "vtr-session-05",
      "title": "Verse Typing Race Deck 5",
      "theme": "Faith",
      "rounds": [
        {
          "id": "vtr-r021-john-14-29",
          "reference": "John 14:29",
          "sourceTranslation": "KJV",
          "theme": "Faith",
          "verseText": "And now I have told you before it come to pass, that, when it is come to pass, ye might believe.",
          "difficulty": "hard",
          "teachingNote": "Review John 14:29 and the full verse before continuing."
        },
        {
          "id": "vtr-r022-john-16-22",
          "reference": "John 16:22",
          "sourceTranslation": "KJV",
          "theme": "Joy",
          "verseText": "And ye now therefore have sorrow: but I will see you again, and your heart shall rejoice, and your joy no man taketh from you.",
          "difficulty": "easy",
          "teachingNote": "Review John 16:22 and the full verse before continuing."
        },
        {
          "id": "vtr-r023-john-18-9",
          "reference": "John 18:9",
          "sourceTranslation": "KJV",